{
  "ok": true,
  "ticket_id": 120,
  "compiled": 8,
  "out_of_scope": 5,
  "scenarios": [
    {
      "scenario_id": "P02",
      "ticket_id": 120,
      "pantalla": "FrmDetalleClie.aspx",
      "titulo": "La columna \"Fecha de ingreso judicial\" no es recuperable por configuracion",
      "precondiciones": [
        "El usuario accede a la Vista Obligaciones en la instancia Pacifico"
      ],
      "pasos": [
        {
          "accion": "wait_visible",
          "target": "msg_titulo_cliente",
          "valor": null
        }
      ],
      "oraculos": [
        {
          "tipo": "invisible",
          "target": "cmbProvincia",
          "valor": "Fecha de ingreso judicial"
        },
        {
          "tipo": "invisible",
          "target": "cmbDepartamento",
          "valor": "Fecha de ingreso judicial"
        }
      ],
      "datos_requeridos": [],
      "origen": {
        "ticket_section": "plan_pruebas",
        "item_id": "P02"
      },
      "data_readiness_preconditions": [
        {
          "entity": "CLIENTE",
          "type": "grid",
          "input_data": {
            "CLCOD": "{{CLCOD}}"
          },
          "expected": {
            "min_rows": 1
          }
        }
      ]
    },
    {
      "scenario_id": "P05",
      "ticket_id": 120,
      "pantalla": "FrmDetalleClie.aspx",
      "titulo": "Comportamiento con campos sin valor (nulos) en los 8 nuevos campos",
      "precondiciones": [
        "Existencia de una obligación con campos nulos en los 8 nuevos campos."
      ],
      "pasos": [
        {
          "accion": "navigate",
          "target": "FrmDetalleClie.aspx",
          "valor": null
        },
        {
          "accion": "wait_networkidle",
          "target": "grid_obligaciones",
          "valor": null
        }
      ],
      "oraculos": [
        {
          "tipo": "page_contains_text",
          "target": "grid_obligaciones",
          "valor": "-"
        },
        {
          "tipo": "page_contains_text",
          "target": "grid_obligaciones",
          "valor": ""
        },
        {
          "tipo": "visible",
          "target": "grid_obligaciones",
          "valor": null
        }
      ],
      "datos_requeridos": [
        {
          "tabla": "obligaciones",
          "filtro": "fuente_ingesta_nula"
        }
      ],
      "origen": {
        "ticket_section": "plan_pruebas",
        "item_id": "P05"
      },
      "data_readiness_preconditions": [
        {
          "entity": "CLIENTE",
          "type": "grid",
          "input_data": {
            "CLCOD": "{{CLCOD}}"
          },
          "expected": {
            "min_rows": 1
          }
        }
      ]
    },
    {
      "scenario_id": "P06",
      "ticket_id": 120,
      "pantalla": "FrmDetalleClie.aspx",
      "titulo": "Valores \"Si\"/\"No\" del campo \"Afiliado al Debito Automatico\"",
      "precondiciones": [
        "El lote con obligación V000000201605P debe estar disponible.",
        "La vista Obligaciones debe ser cargada."
      ],
      "pasos": [
        {
          "accion": "navigate",
          "target": "FrmDetalleClie.aspx",
          "valor": null
        },
        {
          "accion": "wait_networkidle",
          "target": "msg_titulo_cliente",
          "valor": null
        }
      ],
      "oraculos": [
        {
          "tipo": "page_contains_text",
          "target": "OGDEBAUT_DESC",
          "valor": "Si"
        },
        {
          "tipo": "page_contains_text",
          "target": "OGDEBAUT_DESC",
          "valor": "No"
        },
        {
          "tipo": "page_not_contains_text",
          "target": "OGDEBAUT_DESC",
          "valor": "Otro"
        },
        {
          "tipo": "page_not_contains_text",
          "target": "OGDEBAUT_DESC",
          "valor": "null"
        }
      ],
      "datos_requeridos": [
        {
          "tabla": "Obligaciones",
          "filtro": "V000000201605P"
        }
      ],
      "origen": {
        "ticket_section": "plan_pruebas",
        "item_id": "P06"
      },
      "data_readiness_preconditions": [
        {
          "entity": "CLIENTE",
          "type": "grid",
          "input_data": {
            "CLCOD": "{{CLCOD}}"
          },
          "expected": {
            "min_rows": 1
          }
        }
      ]
    },
    {
      "scenario_id": "P07",
      "ticket_id": 120,
      "pantalla": "FrmDetalleClie.aspx",
      "titulo": "Los 8 nuevos campos son de solo lectura para todos los perfiles",
      "precondiciones": [
        "El usuario ha cargado la Vista Obligaciones de la instancia Pacifico con un lote con datos en los 8 nuevos campos."
      ],
      "pasos": [
        {
          "accion": "navigate",
          "target": "FrmDetalleClie.aspx",
          "valor": null
        },
        {
          "accion": "wait_visible",
          "target": "msg_titulo_cliente",
          "valor": null
        }
      ],
      "oraculos": [
        {
          "tipo": "invisible",
          "target": "input_nombre",
          "valor": null
        },
        {
          "tipo": "invisible",
          "target": "input_apellido",
          "valor": null
        },
        {
          "tipo": "invisible",
          "target": "cmbProvincia",
          "valor": null
        },
        {
          "tipo": "invisible",
          "target": "cmbDepartamento",
          "valor": null
        },
        {
          "tipo": "visible",
          "target": "OGCANAL",
          "valor": null
        },
        {
          "tipo": "visible",
          "target": "OGMEDIOPAGO",
          "valor": null
        },
        {
          "tipo": "visible",
          "target": "OGDEBAUT_DESC",
          "valor": null
        },
        {
          "tipo": "visible",
          "target": "DESALDOFAVOR",
          "valor": null
        },
        {
          "tipo": "visible",
          "target": "OGCUOTA",
          "valor": null
        },
        {
          "tipo": "visible",
          "target": "OGMONTOCUOTA",
          "valor": null
        },
        {
          "tipo": "visible",
          "target": "OGCORREDOR",
          "valor": null
        },
        {
          "tipo": "visible",
          "target": "OGNROCUOTAS",
          "valor": null
        }
      ],
      "datos_requeridos": [],
      "origen": {
        "ticket_section": "plan_pruebas",
        "item_id": "P07"
      },
      "data_readiness_preconditions": [
        {
          "entity": "CLIENTE",
          "type": "grid",
          "input_data": {
            "CLCOD": "{{CLCOD}}"
          },
          "expected": {
            "min_rows": 1
          }
        }
      ]
    },
    {
      "scenario_id": "P08",
      "ticket_id": 120,
      "pantalla": "FrmDetalleClie.aspx",
      "titulo": "Formato monetario de \"Saldo a favor disponible\" y \"Monto de la Cuota\"",
      "precondiciones": [
        "Existen obligaciones con valores monetarios en 'Saldo a favor disponible' y 'Monto de la Cuota'.",
        "La instancia Pacifico tiene una configuración de formato numérico y moneda definida."
      ],
      "pasos": [
        {
          "accion": "wait_visible",
          "target": "input_nombre",
          "valor": null
        },
        {
          "accion": "wait_visible",
          "target": "input_apellido",
          "valor": null
        },
        {
          "accion": "scroll_into_view",
          "target": "input_nombre",
          "valor": null
        }
      ],
      "oraculos": [
        {
          "tipo": "visible",
          "target": "input_nombre",
          "valor": null
        },
        {
          "tipo": "visible",
          "target": "input_apellido",
          "valor": null
        },
        {
          "tipo": "page_contains_text",
          "target": "None",
          "valor": "Saldo a favor disponible"
        },
        {
          "tipo": "page_contains_text",
          "target": "None",
          "valor": "Monto de la Cuota"
        }
      ],
      "datos_requeridos": [
        {
          "tabla": "Obligaciones",
          "filtro": "V000000201605P"
        }
      ],
      "origen": {
        "ticket_section": "plan_pruebas",
        "item_id": "P08"
      },
      "data_readiness_preconditions": [
        {
          "entity": "CLIENTE",
          "type": "grid",
          "input_data": {
            "CLCOD": "{{CLCOD}}"
          },
          "expected": {
            "min_rows": 1
          }
        }
      ]
    },
    {
      "scenario_id": "P11",
      "ticket_id": 120,
      "pantalla": "FrmDetalleClie.aspx",
      "titulo": "La sub-vista de detalle de cuotas no se ve afectada (regresion)",
      "precondiciones": [
        "El usuario ha cargado la Vista Obligaciones de la instancia Pacifico con un lote que tiene obligaciones con cuotas."
      ],
      "pasos": [
        {
          "accion": "navigate",
          "target": "FrmDetalleClie.aspx",
          "valor": null
        },
        {
          "accion": "wait_visible",
          "target": "msg_titulo_cliente",
          "valor": null
        }
      ],
      "oraculos": [
        {
          "tipo": "visible",
          "target": "OGCANAL",
          "valor": null
        },
        {
          "tipo": "visible",
          "target": "OGMEDIOPAGO",
          "valor": null
        },
        {
          "tipo": "visible",
          "target": "OGDEBAUT_DESC",
          "valor": null
        },
        {
          "tipo": "visible",
          "target": "DESALDOFAVOR",
          "valor": null
        },
        {
          "tipo": "visible",
          "target": "OGCUOTA",
          "valor": null
        },
        {
          "tipo": "visible",
          "target": "OGMONTOCUOTA",
          "valor": null
        },
        {
          "tipo": "visible",
          "target": "OGCORREDOR",
          "valor": null
        },
        {
          "tipo": "visible",
          "target": "OGNROCUOTAS",
          "valor": null
        }
      ],